library_type,academy,year,season,category,subject,author,dynasty
课题库,求志书院,1888,春,算学,"取象限弧任分为四命四弧，正弦为甲乙丙丁，又命半径为一，乃 任取甲乙二正弦，各求得余弦，次以甲乘乙余弦，乙乘甲余弦，相加命 戊为则丙丁戊三数连乘倍之复以三数各自加乘之，必等于一，试 证之",未知,清
课题库,求志书院,1888,春,算学,"有高句股和即合股，或平句股和即合句，有平句股较，即断句或  高句股较，即断股法，以二数相乘，各为长方积，以二数相减，为长阔  和，或相加为长阔较，各开平方得长为合句或合股，阔为断股或断句， 又二数相乘倍之，各为长方积，二数相加为长阔和或相成为长阔较， 各开平方得长，均为城径，盖断合二股相减，二句相加，俱为城径，知  此剔诸术易解，以图证之",未知,清
课题库,求志书院,1888,春,算学,"以三角立垛，一层一、二层三、三层六，逐层为乘法，自上而下，与 三角平垛相乘得三个三乘积，与本形自乘得六个四乘积，若除去一二 三诸层不用，以截积诸层与平立垛相乘，所得之增二乘积仍为三个及 六个，惟高与正负之数各不相同，试详言之",未知,清
课题库,求志书院,1888,春,算学,"为甲倍，同高三角立垛内少甲加乙减一为倍数之高减一之积复多乙 倍高减二之积，又三角平垛全积，或截积顺乘，立垛所得三乘垛皆为 三个，惟高与正负之数各不相同，知此二理，,复命三减十为卯，则演 得二十四倍，共银得五六二八零为负实，甲乘卯加一与乙乘卯加二相 加十二之又以四卯加六减之得八六六为上廉正，甲乘卯加三以乙乘 卯减之十二之又以九减之得四五九为中廉正，乙减甲二十四之加四 卯又加六得一零六为下廉正，九正隅开三乘方得日数，试依法演之。",未知,清
课题库,求志书院,1888,夏,经学,"〇史学题：问《汉书 ·地理志》郡国下盐官、职官、工官、服官、木 官、陂官、湖官、均输官、家马官、牧师官、发弩官、圃羞官等名，《百官 表》漏略不载者甚多，能考其说欤?高帝求贤诏遣诣丞相府署行义 年，何者谓仁?何者谓义?万室之邑必自万钟之藏藏襁千万、千室之 邑必有千钟之藏藏襁百万论",未知,清
课题库,求志书院,1888,夏,经学,"汉郡中称将论。",未知,清
课题库,求志书院,1888,夏,算学,"海镜中通虚大小差高平黄极边惠底明各句股和与各句股较及高 平二句股和之和，较二句股之和与较，诸事中任知二和或二较，求半 城径，法虽各异，如展转相求，其末俱不出合断二形之公法，问各和较 与合断二形何关?并问二公法比例之意何?凡句股和较，视股弦及 句弦和较之理较为深，遂故海镜中以合断诸题为尤，虽学者务宜 留 意 。",未知,清
课题库,求志书院,1888,夏,算学,"假如买麦为粮，所余皮糠倾麦价十一分之二，依此价值，向麦主 易麦，又余皮糠，仍易如是，屡易全尽而止，今但知原麦八十斤，问依 屡易之法增麦，或共得麦各几何?又但知原有并屡易数共得百劬，问 原有麦或初次易得之麦各几何?须各依巡求法得其密数",未知,清
课题库,求志书院,1888,夏,算学,"米十六石三斗八升，试以兵数、米数，各求得日数开方式，则得兵数。 为四角立垛截积，命截积上面为甲，截去之虚积底而为乙，则截积丙  为甲倍同高之三角立垛内少甲加乙减二为倍数之高减一之积复多乙  倍高减二之积，知此复知三角立垛倒乘所得，方易从事",未知,清
课题库,求志书院,1888,夏,算学,"今有官司依平方招兵，逐日递以方边减一之间积为招得数，但知  末日招十六人，每人每日给米仍如前类递减一升，至末日每人祗给一  升，共给米三十四石五斗八升，准春课，三角立垛每厅顺乘他垛，所得 增二乘积之倍数，及前题四角立垛截积所函之倍数，则得百二十倍， 米数为负实，即四一四九六零，甲加三乙十因之丙减十二为一廉，即 四一八正三，甲加乙减二复十五之为二廉，即八二五正五，甲减三乙  十因之为三廉，即五三零正，甲减乙加二复十五之为四廉，即一三五 正，十二正隅开四乘方得日数。",未知,清
课题库,求志书院,1888,秋,算学,"欲作句股形，令句股较等于黄方。法任取一数为股弦较，以三之  平方根加一乘之，或二因较以三之平方根减一除之，均得句股较，以 二较屡加得句股弦。又法任取一数为句，倍之为弦，依法求得股， 亦合",未知,清
课题库,求志书院,1888,秋,算学,"如欲令句弦较等于黄方。法任取一数为句弦较，倍之为股，三之 为倍句，五之为倍弦，如欲令句弦较等于弦较较。法任取一数为股弦 较，以五之平方根加三乘之，或四因较以五之平方根减三除之，均得 句弦较，以二较加减得句股弦。又法任取一数为句，倍之为股，依法 求得弦，亦合",未知,清
课题库,求志书院,1888,秋,算学,"有甲乙二弧之和弧正弦，求和弧余弦。常法以和弧正弦幂减半 径幂开平方即得，若已知甲乙二正弦，则无庸开方。法以甲乙二正弦 幂并减和弧正弦幂，以半径乘之，甲乙两正弦相乘除之，复半之，亦 得，试证之",未知,清
课题库,求志书院,1888,秋,算学,"乙，甲幂为子，甲幂加乙幂减二为丑，乙幂为寅，再命甲加一乘丑为 角，甲加二乘寅为亢，则甲等于二者高减一之倍数，为角减子负高减 二之倍数，为亢正高减三之倍数，为寅负甲等于三之诸倍数，高减一 为角，负高减二为亢，加丑正高减三为二寅，负甲等于四之诸倍数，高 减一为角，加子负高减二为亢，加二丑正高减三为三寅负，顺是以下 递加一子一丑一寅即得。又甲等二或三或四，则两正倍数与两负倍 数相消得甲，加一或甲或中减一各倍之之数，即皆为六个，仍与全积 倍数等。试言其理",未知,清
课题库,求志书院,1888,秋,算学,"今有官司依立方招兵，初日二十七人，次日六十四人，顺是递以 方边增一之立方积为招得数。初日每人给米一升，以下每日每人递 加一升，共给米百四十一石八斗二升。此乃直剖四角立垛以每行为 乘法，右行平三角垛为第一乘法，其余挨次递乘，与三乘垛自上而下 逐层相乘，乘得之数与三角平垛乘所乘之增一乘积等，其乘同高之垛 为平垛全积，其乘高递减一之垛为平垛递少一层之截积，无论全垛截 垛为乘法乘得之数同高与高减一之倍数相并，在本题皆为五个五乘 积。又准前题识别之理，共得五乘垛同高者二十七正高，减一者二十 正高，减二者三十九负高，减三者三十正高，减四者八负，因演得二十 四倍米数三千四百零三石六斗八升为负实，五十八为一廉正，二百三 十五为二廉正，二百五十一为三廉正，八十八为四廉正，十五为五廉 正，一正隅开立方得日数，试为细草。",未知,清
课题库,求志书院,1888,秋,算学,"长为半径，若乙小于半甲，则长阔较变为长阔和，亦开得长为半径，若 乙等于甲，则取甲幂四之三开正平方得半径，若乙等于半甲则置甲六 因七除之得半径，试证之",未知,清
课题库,求志书院,1888,秋,算学,"有虚句股和甲，断句股较乙，法以倍乙减甲，以甲乘之八除之为 长方积，四除乙以减甲为长阔和，开得长为半城径，此题亦有四限，俱 能令开方式变为他式，试演之",未知,清
课题库,求志书院,1888,秋,算学,"今有官司依平方招兵，每日递以方边减一之平方积为招得数，但  知末日招十六人，初日每人给米一升，次日以下每人递加一升，共给  米四十七石七斗四升。此乃直剖四角立垛为乘法，左行高为第一乘  法，与末日人数相乘，其余挨次递乘，至以三角平垛乘初日人数而止， 欲明此法，须先善绘图法",未知,清
课题库,求志书院,1888,秋,算学,"命所乘截垛之诸层，自下而上为子丑寅卯， 以第一乘法高乘子得高个子，乃直书诸子于左行，以第二乘法乘丑得  二高个丑少一丑，乃直书一层丑二层，以下皆为二丑于左次行，依法  又次行为一寅、二寅以下皆三寅，又一卯二卯三卯以下皆四卯，乘讫  于底之左畔作线，至右畔折而向上为外界线，由外至内依磬折层数作 诸界线，则第一层必为一子，又乘法内除去左一二诸行不用，则图内  第一层必为一子加二子，或一子加二子又加三子，故统计乘得四乘  垛，高虽不同，皆为九倍，再准截积理，共得四乘积，同高者十六个，正 高减一者十一个，正高减二者十三个，负高减三者四个，正试演开方  式以求日数，今有三角四角立垛各一所，共积为甲，只云三角底面积  不及四角底面积为乙，求各垛之高，设不用代数及二元法，惟以天元  依条段演之，法当若何?",未知,清
课题库,求志书院,1889,春,算学,"乙，求三角形之边。法以甲乙各自乘，又以甲乙相乘，三数相加，三约 之开平方，得半边，作图证之",未知,清
课题库,求志书院,1889,春,算学,"假如正切等于半径之半，则其正割半径差，必等于三十六度正割 半径差之半，试完其理",未知,清
课题库,求志书院,1889,春,算学,"有合句股和甲，虚句股较乙法，置甲幂内减乙幂四之一复以乙幂 乘之为正实，乙幂乘中五因二约之为上廉负，四除甲幂以乙幂减之为 中廉负，甲为下廉正，一负隅开三乘方得城径",未知,清
课题库,求志书院,1889,春,算学,"有通句股和乙，虚句较甲，法以甲乙相乘自之倍之为负实，甲幂 乘乙倍之为上廉正，乙幂内减甲幂半之为中廉正，如甲大于乙，则为 负，倍乙为下廉负，正隅开三乘方得城径，右有通句股和较甲，虚句股 乙，求城径，得式同。",未知,清
课题库,求志书院,1889,夏,算学,"方根，各用代数式开立方，问各得何式?",未知,清
课题库,求志书院,1889,夏,算学,"假如三角寅垛与三角卯垛相乘，求乘得之寅加卯减一垛高递减 一诸倍数，设卯小于寅，法以一为一级，卯减一为二级，置二级以卯减 二乘之二除之为三级，置三级以卯减三乘之三除之为四级，下皆如 是，至卯减尽而止，列左幅，次以一为一级，寅减一为二级，仍以同理 求得诸级，至与左幅同层而止，列右幅，乃以左右二幅一级与一级、二 级与二级逐级相乘，讫为所求公式，此公式一级，即寅加卯减一垛同 高之倍数二级，即高减一之倍数三级，即高减二之倍数，以下类推，有 此总式则，则古昔斋自乘诸法可废，即李君所未思及之相乘诸法，亦 可废，试证其理。",未知,清
课题库,求志书院,1889,秋,算学,"正余切相加等于倍弧倍余割，正余切相减等于倍弧倍余切，试 证之",未知,清
课题库,求志书院,1889,秋,算学,"假如甲之卯方为第一级，甲之卯减二方乘乙之二方为第二级，甲 之卯减四方乘之四方为第三级，以下指数甲递减二，乙递增二，至末 级为乙之卯方，此式若俱正号，又其卯为倍偶数，或前半级正号，后半 级负号，又其卯为倍奇数，则其式皆可化为二级数相乘之式，且原式 与相乘之式又皆可化为他二式相除之式，试证之",未知,清
课题库,求志书院,1889,秋,算学,"有等腰三角形，知二腰夹角，又各角之点在三平行直线上，乃作  垂线与三线正交分垂线为二段，其一端至腰角所引之平线者，命其段  为甲， 一端至底点所引之下一平线者，命其段为乙，法以甲自之于上， 甲乙相乘于中，以半夹角正弦幂四之为一率，半径幂为二率，乙幂为  三率，得四率于下，以上中下相并，开平方得分角线，既得分角线真  数，则以半夹角诸线比例之，即得底与等腰真数，试证其理",未知,清
课题库,求志书院,1889,秋,算学,"方，三层至甲加二之立方，余类推，次分其积为左右二幅，左为卯高相  乘，右为立方截积与三角平垛倒乘所得，其立方截积原为四角立垛截 积与同高三角平垛截积相乘之数，既知四角立垛截积所函三角立垛 倍数，又如三角平垛截积与三角立垛逐层相乘，命平截积首层为甲， 则得三角三乘积同高者，甲倍正高减一者，甲减三倍负次以递截一层  之平垛与高递减一之立垛相乘，则得高递减一者，甲加一及甲加二及  甲加三各倍数止高，又递减一者，甲减二及甲减一及甲及甲加一各倍  数负以乘得诸倍数，依诸高相并，复以其积各增一乘，又以甲之三乘  方减二个甲之立力加甲之平方四约之，代左幅之卯，左右相并，则得 本截积所函三角四乘垛同高者，甲加一之平方甲幂乘之四约之正高  减一者，甲加一之平方甲幂乘之以甲加一之立方减之负高减二者，甲 幂减三以三因甲幂乘之加八又二约之正高减三者，用减一之平方甲 幂乘之以甲减一之立方加之负高减四者，甲减一之平方甲幂乘之四 约之正，试详证之。",未知,清
课题库,求志书院,1889,秋,算学,"设有梯田一段，欲将全积截为二分，令下截积得全积寅分之卯， 上截积得全积寅分之辰，有上下阔，求截线。法以上阔幂乘卯，下阔  幂乘辰，二乘得数相并，以寅除之，开平方，得截线，以比例证之",未知,清
课题库,求志书院,1889,秋,算学,"设有圆台一所，欲将全积截为二分，令上下截积，亦得全积寅分 之辰与卯，有上下面径，求截面径。法以上面径之立方积乘卯下面径 之立方积，乘辰二乘，得数相并，以寅除之，开立方，得截面径，亦以比 例证之",未知,清
课题库,求志书院,1889,秋,算学,"或寄法为母之甲丙和，皆为整数，试证之",未知,清
课题库,求志书院,1889,秋,算学,"圆球体自上下顶点凿孔，令通，但知凿去之积得球积四之三，或 四之一，或二之一，有球径，求各孔径。法以二之立方根倍之以除一， 或以二除三又六之立方根除之，或以四之立方根除一，为各高率之自  乘数，以各减于单一，各开平方，复各以球径乘之，得各孔径，试证其 理",未知,清
课题库,求志书院,1889,秋,算学,"设球径为一，问各孔径与体积之高各真数",未知,清
课题库,求志书院,1890,春,算学,"有合弦和较或弦和和甲，有断弦和较或弦和和乙，法以甲乙二幂 相减半之为长方积，倍甲为长阔和，开平方得长或阔为城径，有断弦 较和或弦较较甲，合弦较和或弦较较乙，法仍以甲乙二幂相减半之为 长方积，倍甲为长阔较，开平方得阔或长为城径，试并证之",未知,清
课题库,求志书院,1890,春,算学,"以平垛截去一层之积，与平垛相乘截去二层之积，与立垛相乘截  去天层之积，与天乘垛相乘乘得之积，比原垛俱为增一乘积，其增一  乘积之倍数同高者，俱如平截积之首层数，俱无高减一之正负诸积， 若移易之，以任一截积与任垛相乘，则必有高减一之正负诸积，试言  其理",未知,清
课题库,求志书院,1890,春,算学,"一正隅开立方得乙，如前作连比例四率，以四率之和开立方仍得甲丙 和，此法求得之乙亦未必为整数，然二三四率虽为分数，而四率之和 必为整数，以开得之立方根甲丙和均为自取之数故也，试证其法，若 能思得他法胜此者尤佳。",未知,清
课题库,求志书院,1890,夏,算学,"次以甲乙相减自之半之于上甲乙相乘倍之以减上位为负上廉，下廉 空一正隅开立方得城径，若将断弦和较乙改为断弦和和乙，则所得之 式为负实，余同前",未知,清
课题库,求志书院,1890,夏,算学,"有合弦较较甲，断弦和较乙，法置甲乙相加，又以甲乙连乘之为  负实，次以甲乙相加自半之于上，甲乙相乘倍之以加上位为负上廉， 下廉空一正隅开立方得城径，若将断弦和较乙改为断弦和和乙，则所 得之式为正实，余同前，欲作弧矢绩，令得全圆面四之一，有圆径，求 弦矢。此题以疏率求之，以密率求之，易难试言其法",未知,清
课题库,求志书院,1890,夏,算学,"三角诸乘垛，两截积相乘，求乘得积所函诸垛各倍数，法命此截 积指数为寅，截去层数为午，置截积首层分为寅项，其一项定为一个， 二项为午个，三项为午之平垛，四项为午之立垛，寅项为午之寅减一  垛，诸项之数，即截积所函同乘垛递降至一垛诸倍数，又命彼截积指 数为卯，截天层数为未，亦分首层为卯项，两截积相乘，准前课寅卯二 垛相乘公式，公分计之，可各得不同高诸垛，合之可得寅加卯减一垛  递降至一垛同高及高递减一诸积",未知,清
课题库,求志书院,1890,夏,算学,"假如以三代寅，四代卯，又四代午， 三代未，则依法求得同高者",未知,清
课题库,求志书院,1890,夏,算学,"六垛一个，五垛七个，四垛二八个，三垛  六四个，二垛百个，一垛百个，高减一者，六垛六个，五垛二四个，四垛  三六个，三垛二四个，高减二者，六垛三个，垛三个，垛将同高不同乘  诸垛，化为同乘不同高正负诸垛，则共得六垛同高者三百正，高减一  者一零六五负，高减二者一六五八正，高减三者一三五九负，高减四 者五七六正，高减五者百负，试详证之。",未知,清
课题库,求志书院,1890,冬,算学,"乘甲幂倍之为上廉正，乙幂内减甲幂半之为中廉正，倍乙为下廉负， 一正隅开三乘方得城径。此式甲必大于乙，故中廉应改作甲幂内减  乙幂半之为中廉负，有合弦较较甲，断弦较和乙，法求得开方式如前  题，惟二项与四项反其正负，又甲若大于乙，亦应将中廉尽反正负，试  两证之",未知,清
课题库,求志书院,1890,冬,算学,"假如三角形知三边和，知面积，又知一角，求角之对边，法以角之  余割余切相加面积乘之半和幂除之以减单一，复以半和乘之得所求， 试证其理",未知,清
课题库,求志书院,1890,冬,算学,"欲作三角诸乘垛之代数式，有数法，命其层数为辰，指数为卯，一 法曰以一为一级，卯为二级，置二级以卯加一乘之二除之为三级，置 三级以卯加二乘之三除之为四级，如是求至卯加辰减二乘之辰减一 除之而止",未知,清
课题库,求志书院,1890,冬,算学,"二法曰以辰为一级，以辰减一乘一级二除之为二级，以辰 减二乘二级三除之为三级，如是求至辰减卯复加一乘之卯除之为左 幅，次以一为一级，以卯减一为二级，以卯减二乘二级二除之为三级， 如是求至一乘之卯减一除之为右幅，置左右二幅逐级相乘为求得式",未知,清
课题库,求志书院,1890,冬,算学,"三法曰置一以卯加一卯加二至卯加辰减一连乘之，以二三四诸数至 辰减一连除之而止",未知,清
课题库,求志书院,1890,冬,算学,"四法曰置辰以辰加一辰加二至辰加卯减一连乘 之，以二三四诸数至卯连除之而止，问一二法逐级所代何数，并三法 取义之原，至四法虽属常理，惟从前亦未经人阐释。",未知,清
课题库,求志书院,1890,冬,经学,"胡同频、胡玉缙、孙同康、孙师郑、沈毓英。",未知,清
课题库,求志书院,1891,春,算学,"有断勾股较甲，有合弦和较，或弦和较，或弦皆为乙，求城径，所 得三开方式两同而一异，试演细草",未知,清
课题库,求志书院,1891,春,算学,"有合勾股和甲，有断弦较和，或弦较较，或弦皆为乙，求城径，所 得三开方式俱异，试并演之",未知,清
课题库,求志书院,1891,春,算学,"切相加为法，半和为实，法除实，以右半角或左半角正余切相加乘之， 得左角或右角所对之边，试证之",未知,清
课题库,求志书院,1891,春,算学,"依前题求两角所夹之边，法以两半角正切相乘，以减单一，复以 半和乘之，得所求，又法以两半角余切相加为法，两本角余切相加以 和乘之为实，法除实亦得所求，又法两角正弦相加，又以和角正弦加 之为法两，角正弦相加以和角正弦减之为实，法除实以减单一，复以 半和乘之亦得所求，后二法皆可化为两半角余切相加为法，两半角正 切相加为实，法除实以减单一复以半和乘之为所求式，再化之即与前 式同，试并证之。",未知,清
课题库,求志书院,1891,春,算学,"附量○舆地题：昧谷考",未知,清
课题库,求志书院,1891,春,算学,"拟书新刻《黄河图》后。",未知,清
课题库,求志书院,1891,夏,经学,"〇史学题：《汉武帝内传》考证",未知,清
课题库,求志书院,1891,夏,经学,"《唐顺宗实录》考证",未知,清
课题库,求志书院,1891,夏,经学,"《郑康成别 传》考",未知,清
课题库,求志书院,1891,夏,经学,"《文中子世家》考。",未知,清
课题库,求志书院,1891,夏,算学,"又断形中一为首句股较，中弦较和末倍弦较和加径二为首句股 较，中弦较较末径内减倍弦较较三为首径，加倍弦较和中径末径内减 倍弦较较四为首句股较，中股末股加半径五为首句股较，中句末半径 内减句六为首半径，加股中半径末半径内减句，凡此三率比例，可化 为无穷四率比例，且可化为无穷合断相参之四率比例，故凡遇合断诸 题，但就本形取义，自得理，所从生无须牵涉他形，徒取纷烦而欠 画一",未知,清
课题库,求志书院,1891,夏,算学,"今有负积六十四开十一乘方可得四个方根，又有正积单一开七 乘方可得八根，试证各根之理",未知,清
课题库,求志书院,1891,夏,算学,"有讷对级数，其首级以真数减一为实，真数为法，或一为法，欲由 此级回求得真数，法以全级为一级正，一级自之二除之为二级负， 一 二级相乘三除之为三级正，求得诸级以减单一为法，一为实，法除实 得讷对，求真数之级数，又法径以全级为二级，自之二除之为三级，二 三级相乘三除之为四级，求得诸级，复以一为一级，加之亦得，若但有 对数，不知原级者，则依二项例以对数代其天，以一代其甲与卯，依法 略加变通，所得诸级亦合，试言其理，并演除法细草。",未知,清
课题库,求志书院,1891,秋,算学,"凡除法皆可化为级数，如甲除乙，设乙小于甲，则以甲加乙除乙  为一级，一级自之为二级，设乙甚小于甲，则可以甲减乙除乙为一级  正，一级自之为二级负，各求至多级，设乙大于甲，则先以法除实得单  一，以上诸整数以法除余实之式，依前求得级数以加整数即得，又实  大于法者，另有妙法可化级数，视除得数小于原实，乃任取一数乘其  法，实令除得数甚小于乘得之实，即命除得数与乘得实之较为寅，以  乘得之法除寅为一级，乘得法除一级为二级，若视除得数大于原实， 乃任取一数约其法，实令除得数甚大于约得之实，即命除得数与约得  实之较为卯，即为一级，约得法乘一级为二级，各求至多级，若无论法  实大小，欲得公术，则以甲加一除乙为一级，甲加一除一级为二级，或  以甲减一除乙为一级正，甲减一除一级为二级负，亦皆至多级，试详  其理",未知,清
课题库,求志书院,1891,秋,算学,"凡乘法皆可化为级数，如大数寅、小数卯相乘，可令寅等于甲加  一或甲减一，乃以甲除一，依前除法化为一正级、一正负相间级，以二 级数加一或减一，各以甲卯连乘之得所求，合观乘除诸式，可知凡数  皆可化级数。设有数丙，可以丙加一为一级正，丙除一级为二级负， 又可以丙减一为一级，丙除一级为二级，亦各求至多级，试并证之",未知,清
课题库,求志书院,1891,秋,算学,"与原式不同，又甲减天之二项例，亦可依此法化为另一级数。曩谓二 项例可化四式，其化法甚多，除此法外，尚有加负级减正级之法，又有 取一数加天或减天以代甲而除逐级之数，以除得诸级依原正负加减 之亦得，因近人鲜有知四式者，兹特明示，但以丁除左畔，演得细草 即合。",未知,清
