library_type,academy,year,season,category,subject,author,dynasty
课题库,求志书院,1882,冬,算学,"原有梯田积，欲分为三段，令三截积俱为同式形，有长有上下阔， 求两截阔与三截长",未知,清
课题库,求志书院,1882,冬,算学,"有边股底句，法以句股相乘为长方积，句股相加为长阔较，开平 方得阔，为半城径，试证比例之理",未知,清
课题库,求志书院,1882,冬,算学,"设有句股形，令句渐大股渐小，或句渐小股渐大，复令句股相乘 积仍等于原积，问句股加减之较与原句股及加减后之句股诸比例之 理",未知,清
课题库,求志书院,1882,冬,算学,"又或句所加减等于股所减加，问直积极太极小之限",未知,清
课题库,求志书院,1883,春,算学,"欲造句股形，令三事俱得整数，法任取便为除法之小数为句弦 较，取大数为股，又法任取一数为句弦较，以其若干倍为股，又法任取 大数乘小数为股小数，自乘为句弦较，或小数为句弦较，又或大数为 句弦较，俱以有股、有句弦较之法求得句弦，试论诸法熟便",未知,清
课题库,求志书院,1883,春,算学,"又或谓两 数有等者，以大数为股，小数为句弦较，此说何如?",未知,清
课题库,求志书院,1883,春,算学,"海镜图中有连比例五率，以倍边股弦和为一率，边三和为二率， 边句弦和即底股弦和，亦即半通三和为三率，半底三和为四率，半底 句弦和为五率，试言比例之理，并证第三率何以为三形相同之数?",未知,清
课题库,求志书院,1883,春,算学,"假如甲乙二数各自乘相加，又以甲乙相乘加之，欲将此加得之数 开平方得整数，问取甲乙二数之法",未知,清
课题库,求志书院,1883,春,算学,"圆球体任截去甲积，有球径，求截面心距球心线，法以球半径自 乘，再乘倍之于上，置甲积三之，以径一之周率三一四除之，用减上 位，为正实，若上位数小则反减为负实，置半径自乘三之为负，从廉空 一正隅开立方得所求。",未知,清
课题库,求志书院,1883,夏,算学,"句股形有可化作另形之句股，令两形之句弦和与弦和较俱同，而 句股弦不同，法视句股较小于股弦较者，则以两较相减半之为差，以 差减句为句，以差加弦为弦，以倍差加股为股，又法以弦较较为另形 之股，以半句弦较为另形之股弦较，依句股术求得句弦，亦得",未知,清
课题库,求志书院,1883,夏,算学,"若句股较大于股弦较，而不大于三倍股弦较者，则仍以两较相减 半之为差，以差加句为句，以差减弦为弦，以倍差减股为股，或用又 法，仍以弦较较为另形之股，以半句弦较为另形之股弦较，亦得",未知,清
课题库,求志书院,1883,夏,算学,"如所知句股无句股较小于股弦较者，则以法造之，任取一数为前  数，又任取大于前数小于倍前数者为后数，乃以前数自之倍之为甲前  数，乘后数倍之为乙后数，自之为丙，乃以甲乙相加，乙丙相加为一句  一股，甲乙丙相加为弦",未知,清
课题库,求志书院,1883,夏,算学,"又所知句股无句股较小于三倍股弦较者，亦  以法造之，任取一数为前数，又任取大于倍前数小于倍前数，加前数  五分之四者，为后数，仍以前数自之倍之为甲，前数乘后数倍之为乙， 后数自之为丙，如前相加得句股弦，试证其理。",未知,清
课题库,求志书院,1883,春,算学,"倍股弦和内减句弦和为甲，倍句为乙，又内句弦较内减股弦和，或八 股弦较内减句弦和，或四句弦较内减句弦和各为甲，各以四弦和较为 乙，所取句股形，其股弦较大于半弦和较者，用第四术小于半弦和较 者，用第五术至一二三术则施之任何句股形皆可，试证其理",未知,清
课题库,求志书院,1883,春,算学,"假如甲乙各自乘相加，又以卯个甲乙相乘加之，或减之，其卯大 于二或小于二，欲将此四减所得之数开平方得整数，试求公式",未知,清
课题库,求志书院,1883,春,算学,"假如甲乙各自乘再乘，与卯个甲幂乘乙及卯个乙幂乘甲，四数相 并，欲开立方得整数，其卯若大于三，法任取一数为前数，又取大于三 倍前数小于卯倍前数者，以卯除之为后数，乃置前数立方积内减后数 立方积，以三前数减卯后数乘之为长方积，卯个后数幂内减三个前数 幂为长阔较，开平方得，是为分母，次以前后数两立方积相减为甲，以 分母乘后数为乙，乘前数为丙，则申丙和即为原式开得之数，其卯或 小于三，其相并数内或为一寅一卯，又寅卯或作可正可负之数，法均 类推，再三乘方式则开立方而得分母，四乘以上类推",未知,清
课题库,求志书院,1883,春,算学,"设如句股容方形，由正方化作递大递小诸长方及诸扁方，求诸方 最大之限，并论限前限后渐次化作递小诸积之理。",未知,清
课题库,求志书院,1884,春,算学,"假如行道逐日依连比例递增，但知初日行甲里，末日行癸里，求 末日以前之任 一 日所行几何?须以径求得之",未知,清
课题库,求志书院,1884,春,算学,"有句有股，求中容方面，法以句股和为首率，句股较为中率，求得 末率与首率相减四约之得方面，试证其理",未知,清
课题库,求志书院,1884,春,算学,"有句二十，股二十一，弦二十九，又句百十九，股百二十，弦百六 十九，又句六百九十六，股六百九十七，弦九百八十五，又句二万三千 六百六十，股二万三千六百六十一，弦三万三千四百六十一，此数形 之句股较俱为一，欲造此等句股，宜以何法造之?",未知,清
课题库,求志书院,1884,夏,算学,"前数课屡有甲乙各羿加甲乙相乘数开平方得整数诸题，兹引伸 触类，又得数题：法任取三率连比例整数，以六首率加倍中率为甲，倍 中率加半末率为乙，或首率内减倍中率为甲，倍中率内减末率为乙， 或四首率内减四中率为甲，四中率内减末率为乙，或倍中率内减首率 为甲，倍中率内减三末率为乙，此类尚有多题，不及备录，能更举否?",未知,清
课题库,求志书院,1884,夏,算学,"又法任取整数句股形，以二句弦较加倍股为甲，句弦和加倍股为  乙，或句弦较内减倍股弦较为甲，倍句为乙，又句弦较内减八股弦较， 或股弦和内减四股弦较各为甲，各以四弦较较为乙，此类亦有多题， 能更举否?又法任取大小两数，以二数之畀相减为甲，二数相乘积倍  之加小数畀为乙",未知,清
课题库,求志书院,1884,夏,算学,"有大差句股或小差句股，以句股相乘积倍之为长方积，倍句股较 为长阔较，在大差则开平方得阔为城径，小差则得长为城径，试各 证之。",未知,清
课题库,求志书院,1884,秋,算学,"九章盈不足术，有垣厚十尺，两鼠对穿，大鼠日递倍，小鼠日递 半，初日各穿一尺，求得两鼠相逢为三日又十三分日之二，此日下所 带小余，系用平行入算，抑用递增递减率人算，若谓用平行人算，问用 递增递减率所得之分几何?",未知,清
课题库,求志书院,1884,秋,算学,"凡甲乙二羿相加，又以卯个甲乙相乘加之，开平方得甲丙和，此 甲乙丙三数有时但知其一，便可求得余二数，如乙为三，则易知丙为 卯加一，甲为乙丙和，乙为五，丙为二卯加一，甲为乙丙和之二倍，乙 为七，丙为三卯加一，甲为乙丙和之三倍，推之，乙为九，丙为四卯加 一，甲为乙丙和之四倍，顺是以下皆然，试言其理",未知,清
课题库,求志书院,1884,秋,算学,"假如笔墨砚三价，试取天一乘墨价，再乘砚价，则笔二墨三砚四 之价和二千三百，笔三墨四砚二之价和一千四百二十五，笔四墨二砚 三之价和一千七百六十五，只云墨砚价相乘比天之立方多一千六百 二十三，问笔墨砚价及天各几何?",未知,清
课题库,求志书院,1884,秋,算学,"海镜中股弦较与倍句弦和比，若明弦较和算与城径舁比，句弦较 与倍股弦和比，若明弦较较舁与城径舁比，试证之。",未知,清
课题库,求志书院,1884,冬,词章,"O 经学题：言乃欢解",未知,清
课题库,求志书院,1884,冬,掌故,"假如圆球体中穿圆孔，令通，并令穿去之积，得球积之半，有球 径，求孔径。法以球径之五乘方积三因四而一为正实纵空，以球径之 三乘方积三之为一廉负二廉空，以球径之平方积三之为三廉正四廉 空一负隅，开玲珑五乘方得孔径，试证之",未知,清
课题库,求志书院,1884,冬,掌故,"有边句、边股，法以股自之为长方积，句除股舁倍之为长阔较，有 底句、底股，法以句自之为长方积，股除句舁倍之为长阔较，均开平方 得阔为半城径，作图明之",未知,清
课题库,求志书院,1884,冬,掌故,"以句股为正余弦，内容垂线，则句与倍垂线比，若正弦与倍弧正 弦比，又弦与句股和比，若句股较与信弧余弦比，试为图解",未知,清
课题库,求志书院,1884,冬,掌故,"欲将四角立垛积增作峰岚形，令一层为一个一之平方，二层为二 个二之平方，三层为三个三之平方，余类推，别得此形内有六个三角 三乘积，一个以层数为层数，四个以层数减一为层数，一个以层数减 二为层数，各依三角三乘垛求积术，求得各积相并即全积，惟求此积 尝另思得简法，以层数之三乘方积加两个层数之立方积，复加层数之 平方积，四约之即得，试证殊途同归之理。",未知,清
课题库,求志书院,1885,春,算学,"原有甲乙丙同根之诸正负开方式，或同乘数，或不同乘数，取甲 式任升降数位与甲乙内诸式相加，或相减，复将加减所得之式，任升 降数位，仍与诸原式相加减，如是屡次加减所得之式，必仍开得原根， 试言其理",未知,清
课题库,求志书院,1885,春,算学,"正负平方式，无论隅为何数，将式倒置之，令实为隅，隅为实，则 开得之根与原根比，若隅与实比",未知,清
课题库,求志书院,1885,春,算学,"正负立方式，设下廉为三，卯上廉为 卯乘下廉之数，或三乘方式，下廉为四，卯上廉为卯乘下廉三因二除 之数，从为卯乘上廉二因三除之数，自一隅至从，或俱正、或正负相 间，法以实反其正负与卯之方，或三乘方积相加，复开正立方，或正三 乘方与卯相加减，即各得原根三乘，以上类推，试证之",未知,清
课题库,求志书院,1885,春,算学,"假如漏壶一具注水满中，下有大中小三孔，开大中二孔，则水角 时而尽，开中小二孔，亢时而尽，开大小二孔，氐时而尽，问独开一孔， 水尽各需时几何?",未知,清
课题库,求志书院,1885,秋,掌故,"假如有连比例级数，每前级与后级比，若卯与寅比，设寅小于卯， 又其级为无穷项，则可任求至数级，或仅置第一级而止，此后可用一  数以括下诸级之和，法置所止之级，以寅乘之卯减寅除之，即为下诸  级之括数，此数略偏于大胆，所大甚微，在无穷项之尾位，可以不计， 故括数即为密合之数，试证其理",未知,清
课题库,求志书院,1885,秋,掌故,"有半径一，求二十二度半正余弦，法以二之平方根与一相减、或  相加为实，二之平方根倍之为法，又一为实，二因二之平方根与四相  加或相减为法，又三与二个二之平方根相减或一为实，四与二个二之  平方根相减为法，又三与二个二之平方根相加或一为实，四与二个二  之平方根相加为法，各以法除实，复开平方得正弦或余弦，式分四种， 每种二式，均由算理演得",未知,清
课题库,求志书院,1885,秋,掌故,"若于诸法实中笔取其一互乘除，其法实亦  可令诸式互变，且能增得分式，试详诸式之原",未知,清
课题库,求志书院,1885,秋,掌故,"之平方二十一之为四廉负五廉空一正隅，开玲珑一乘方得余弦，以天 元演之",未知,清
课题库,求志书院,1885,秋,掌故,"平方积内有二个三角平垛， 一同高， 一以高减一为高，立方内有 六个三角立垛， 一同高，四以高减一为高， 一以高减二为高，三乘方内 有二十四个三角三乘垛， 一同高，十一以高减一为高，十一以高减二 为高，一以高减三为高，推之，四乘方内必有百二十个三角四乘垛，其 垛之高必有五种总之积，增一乘，其高必增一种，而其个数必视前多 一乘数，乘数即二三四等递加之数，试证之。",未知,清
课题库,求志书院,1885,冬,算学,"二项例可增化得三式，并原式，共成四式，皆可名为二项例，若不 善化，即将原式代作开平立方，及自再乘至平立方各样式，亦可，原式 诸级皆系径求，若由前级以求后级，更觉省事，故可将原式化作递求 之式，然后代作各式，尤见次序井然",未知,清
课题库,求志书院,1885,冬,算学,"三角平垛倒置之，与他垛逐层相乘，所得为他垛之增一乘积，在 玉鉴为撒星形，三角或四角立垛倒置之，与他垛逐层相乘，皆为他垛 之增二乘积，但四角乘得者，内函二积，绘图明之",未知,清
课题库,求志书院,1885,冬,算学,"三角立垛截积为甲，倍同高之三角立垛内少甲加乙减一为倍数 之高减一之积，复多乙倍高减二之积四司立垛截积为子倍，同高之三 角立垛内少子加丑减二为倍数之高减一之积，复多丑倍高减二之积， 问甲乙子丑各代何数?",未知,清
课题库,求志书院,1885,冬,算学,"以重句股和减底句股和为，甲或束句明股相加内减虚弦为甲，各 以平句高股相减为乙，则甲乙二舁相减倍甲除之，均得城径，试言 其理。",未知,清
课题库,求志书院,1886,春,史学,"后魏政归门下省，唐初合三省为一，沿革得失若何?",未知,清
课题库,求志书院,1886,春,算学,"直剖四角立垛为诸行，右行为一二三四诸数，左为二三四，又左 为三四，余类推，以此诸项为乘法，或自右而左，或自左而右，与他垛 逐层相乘，自上而下所得皆为他垛增二乘积，惟此二积内，所函之三 角同乘积，一为寅个，一为卯个，如与三角平垛相乘，则一为三个，一 为五个，三个者一同高，二以高减一为高，五个者一同高，二以减一为 高，一以减二为高，作图证之",未知,清
课题库,求志书院,1886,春,算学,"用前题乘法，与三角立垛相乘，作图 证之",未知,清
课题库,求志书院,1886,春,算学,"设有三乘方式，是与隅俱正号，上中下三廉，或正或负，上廉等于  是之平方根乘下廉之数，则此式可改作平方开之，视上下廉正负同号  或异号，法以是之平方根倍之，命为负，或正与无论正负之中廉相加  为长方积，以正下廉为长阔和或较，开平方得二数，均为原两根之和， 又以此二数各为长阔和较，以原实之平方根为实，复各开平方得四 数，俱为原式之根，如实之倍平方根与中廉相加，适尽，则以实之平方  根，复开平方得正负两根，俱为原式之根，其余两根之和较必等于原  下廉之数，五乘以上各奇乘方如两距等廉之比，俱若一与实之平方根  比，皆可用此法变为指数减半之方开之，试言其理",未知,清
课题库,求志书院,1886,春,算学,"二项例可代作开无量数乘方，或乘至无量数乘方，其方之指数虽 不可知，然其指数极大，则减一二三四诸数可以不计，故每级乘除之 数，可准此理得之，试演其式。",未知,清
课题库,求志书院,1886,春,舆地,"称中土曰唐，或谓就始通时名之，信欤?问英人以三岛制五洲，无尾 大之虞者，何欤?",未知,清
课题库,求志书院,1886,夏,史学,"家骏、黄报廷，不取八名。",未知,清
课题库,求志书院,1886,秋,掌故,"设有天乘方，积十位尾位为单数，方根亦十位，首位为单数，求天  之同数，必藉两数之对数为用，但多位真数无表可检，即变通用之，亦  祗得其略数，故必用级数，径求对数，方为密合，凡多位真数求对数， 及对数求多位真数，其中均有便宜之法，得其法，方易从事，试详  言之",未知,清
课题库,求志书院,1886,秋,掌故,"平圆自圆外任取一点，作诸割线，令抵圆内彼界，若诸割线依次 成连比例率，则圆外诸余线亦必成连比例率，而与诸割线相反，如第 一割线与第四割线之比，若圆外第六余线与第三余线之比，或第五余 线与第二余线之比是也，试言其理",未知,清
课题库,求志书院,1886,秋,掌故,"递增一乘高递减一之三角诸乘垛积，至高减尽而止，依次排列诸 积，首位定为单一，次位为垛积之高，顺是以下，其中位两边之距必等 二项例之指数，若为整数，亦同此理，如指数为偶，则指数加一折半之 级必为中位，指数为奇则指数加一折半之位，在两级夹缝，此位必为 中位，知中位则中位以下诸级可不必求，法将以上诸级逆溯代之，但 每下一级多一次甲除天之乘法耳，开方廉隅表亦然，试言距等之理",未知,清
课题库,求志书院,1886,秋,掌故,"假如甲乙丙丁诸物共有卯个，欲将诸物以一二三四诸数排列之， 使不同色，则一个一排者必有卯色，卯个一排者祗有一色，自一个一 排至二个一排，及三个一排，顺是以往，各色之数必不相同，求此各 数，可以三角诸乘之，试以少数代其卯而详证之。",未知,清
课题库,求志书院,1886,冬,词章,"二○经学题：同人曰解",未知,清
课题库,求志书院,1886,冬,词章,"《曲礼》曰解",未知,清
课题库,求志书院,1886,冬,算学,"设有数始于一，继以卯，继以卯之三角平垛及立垛，以及诸乘垛 积，合之为同高三角诸乘垛之和，欲求此和数。法命底层积之指数为 寅，以寅加一为高，以卯为积之指数，依指数求其三角垛积，即得，若 有数始于一，继以卯为高，继以高递减一之三角诸乘垛之和，至高减 尽而止，法以二屡自再乘至卯方即得，试证之",未知,清
课题库,求志书院,1886,冬,算学,"原有正负立方式，欲求第三项为空，法以地加卯代其原式中之 天，得地元式，以地元式第二项之数自乘，以三因第三项之数减之，开 平方，得或正或负之数，各以原式第二项之数反其号以加之，复三约 之，副以此两数，各代地元式中之卯，则得两个地元立方式，俱空第三 项，试演其法",未知,清
课题库,求志书院,1886,冬,算学,"必先求上下面积，可以字代之，知后必消去故也，且不必定用截积与 虚积为一二率，可用其同比例者为之，试演细草",未知,清
课题库,求志书院,1886,冬,算学,"前题，乙若几等于甲，则法实之式渐等于二分高之一，乙若几等 于无，则其式渐等于四分高之一，设乙与甲比，若十三之平方根减一 与六比，则式等于八分高之三，若乙等于半甲，则式等于二十八分高 之十一，设截积欹斜，其乙等于半甲，乃将截积底面为平圆面，求得圆 径，视上面心欹出底面，心垂线之数，须在圆径加十一分圆径之三内 方可，若乙等于甲，或等于无，则欹出之数断不宜在圆径或倍圆径之 外，否则截积必致倾颓，试证其说。",未知,清
课题库,求志书院,1886,冬,舆地,"候丞、蒋同寅、潘熙",未知,清
课题库,求志书院,1887,春,算学,"直剖四角立垛为诸行，则左行为高，右行为三角平垛，以此诸行 自右而左为乘法，与他垛逐层相乘，自高而下，若除去右一行不用，与 高减一之他垛相乘，,则乘得首层为二次层，为三个增乘积之次层三 层，为四个增乘积之三层，若除去右二行、或右三行不用，与高减二或 高减三之他垛相乘，则得首层为三或为四次层，以下类推，问以此法 相乘，所得增二乘积共有几何?",未知,清
课题库,求志书院,1887,春,算学,"如自左而右为乘法，与他垛逐层相乘，自高而下除去左一行、或 二行、或三行不用，与高减一、或减二、或减三之他垛相乘，视所得比 不除乘得者少若干，则知乘得之增二乘共有几何?",未知,清
课题库,求志书院,1887,春,算学,"假如西贾发银生息，发出本银一两，自本日始每日收回银六厘， 至二百日为满，除收回本银外，共收利银二钱，若用级数代自乘二百  次之法，则知此利为几何?",未知,清
课题库,求志书院,1887,春,算学,"半弧正弦倍之为中率，倍正矢为末率，则可证得本弧角度有二个同 数，问此二角为何度?",未知,清
课题库,求志书院,1887,夏,算学,"合西明股之平方根与茧股之平方根相加为和，有和，有虚股，求城径， 法先求得两根较，次以二根和较求得二根，复求得二股，有明東虚各 股，则一次比例可以得城径，试演其法",未知,清
课题库,求志书院,1887,夏,算学,"设有圆台形，欲将全积分为上下二截积，令各得全积之半，其上  截积之底面，即下截积之上面，命为中面，有上面径，有下面径，有高， 求二截高，并问中面与上下面可成连比例否?",未知,清
课题库,求志书院,1887,夏,算学,"假如发商生息，本利生生不已，每年元旦放出本银为甲，至卯年  共放出卯甲，命一两一年所生之利为乙，至卯年除夕本利一概收回， 问各本与各本所生之利及各利所生之利共收几何?法以卯为第一  级，卯之平垛与乙相乘为第二级，卯减一之立垛与乙之平方相乘为第 三级，卯减二之三乘垛与乙之立方相乘为第四级，顺是以下，至卯减  尽而止，并诸级以甲乘之即收回共数，试言其理",未知,清
课题库,求志书院,1887,夏,算学,"设甲为百两，乙为一  钱，卯为六年，问收回实数几何?",未知,清
课题库,求志书院,1887,夏,算学,"设欲求三个正负方根，作三项为空之立方式，法以圆半径与圆内 所容之十等边为首中率，求得末率，以此三率为三根，命首中率为负 根、或正根，则末率为正根或负根，又法任取大小两根相乘，以两根较  除之得又一根，命除得数与大根同号，小根异号，用上二法求得三根， 各反其根号，以加天元连乘，得式必空第三项，试言其理。",未知,清
课题库,求志书院,1887,秋,算学,"有明弦、東弦，求城径，以天元运求得开方式为贵，若先求虚弦， 复由虚弦转求者次之",未知,清
课题库,求志书院,1887,秋,算学,"假如一为第一级，寅除卯为第二级，二级自乘为第三级，二、三级 相乘为第四级，顺是以下，得无穷级，设有全级，求寅与卯各同数，问 算式宜若何?",未知,清
课题库,求志书院,1887,秋,算学,"前季求垛积，第二层数为全积之指数，命为卯，以底层指数寅加 一为高，依指数卯求其三角垛积即得，后阅课卷，顿悟一法，与此似异 而实同，其法以全积指数卯加一为高，依底层指数寅求其三角垛积亦 得，问二法殊途同归之理",未知,清
课题库,求志书院,1887,秋,算学,"今有五之平方根加二为法，减三为实，法除实开三乘方等于五之 平方根，加一为法，二为实，又有八之平方根三约之以加一为法，减一 为实，法除实开三乘方等于二之平方根，加一为法，一为实，试证之。",未知,清
课题库,求志书院,1887,冬,算学,"平圆半周任分为大小不等三弧，已知三弧之通弦为甲乙丙，求圆 半径，法以甲乙丙连乘四约之为负实，以甲乙丙各自乘相加四约之为 负上廉下廉空一正隅，开立方得所求，试证之",未知,清
课题库,求志书院,1887,冬,算学,"欲知绕地一周为几何里，法于湖水镜平时取竹竿植水中，令出水 面数尺，自植处舟行约十里外，人立舟上最高处，屡以远镜窥之，至不 见为度，因地面凸处所阻，故过此不见，乃平人目悬垂线于水面，量行 垂线尺数，以里率约，竿出水数命为甲，约垂线命为乙，自竿至窥处测 得若干里，命为丙，又命甲乙相加为和，相减为较，则法以甲乙二羿相 加倍之以减丙舁，复以丙舁乘之，较羿除之，又以和羿加之，四约之为 长方积和，乘丙羿较舁，除之复以和减之为长阔和，开平方得阔为地 半径里数以倍周率因之得球周，设乙等于甲，则较等于无，开方式遂 变为极简之法实式，试证其理，能以真数验之尤佳",未知,清
课题库,求志书院,1887,冬,算学,"积内函三角平垛，以三角平垛每层为乘法顺乘他垛，得他垛之峰岚 形，知峰岚形即知增一乘积之倍数，故可演得倍银数，得十四两七钱 为负实， 一为负上廉，十七为正下廉四正隅，开立方得日数，试为 细草",未知,清
